{
  "schema": "bug-assessment/v1",
  "bug_id": "bug-linux-posix-path-classification",
  "revision": 1,
  "markdown": {
    "path": "docs/bugs/bug-linux-posix-path-classification/assessment-1.md",
    "sha256": "663481a83863ccb29ee5449f571096092c19ad00bbf6b48c347b199cc0fd47f4"
  },
  "source": {
    "relation": "current-scope",
    "work_id": "work-20260831-project-knowledge-system-19202d78",
    "reported_by": "implementation-execution Linux full verification",
    "evidence_refs": [
      "host-temp:evidence/bug-linux-posix-path-classification-diagnosis.json",
      "host-temp:evidence/bug-linux-posix-path-classification-knowledge-context.json"
    ]
  },
  "observed_behavior": "On Linux, two BUG owner contract tests fail because ordinary existing POSIX paths are classified as symlink or reparse redirects, which also suppresses the smallest-revision diagnostic.",
  "expected_behavior": "Ordinary POSIX paths are accepted, genuine symlinks remain fail closed, and the smallest available positive assessment revision is enforced.",
  "impact": "The defect blocks the approved Linux full-test and release gates for this delivery while Windows verification remains green.",
  "verdict": "confirmed",
  "severity": "medium",
  "reproduction": {
    "status": "reproduced",
    "symptom_oracle": "The Linux owner suite reports exactly two failures before correction; ordinary directories classify false, genuine symlinks true, and all 19 tests pass after the single-variable correction.",
    "steps": [
      "Run the BUG owner contract suite in the native Linux validation copy.",
      "Probe _is_reparse_path on an ordinary temporary directory.",
      "Replace only missing POSIX st_file_attributes handling at runtime and rerun the two focused failures."
    ],
    "sample": "Full suite reproduced in one of one attempts; the two focused cases passed in one of one controlled pre/post attempts.",
    "command_refs": [
      "host-temp:commands/linux-owner-bug-reproduction",
      "host-temp:commands/linux-posix-single-variable-probe"
    ],
    "evidence_refs": [
      "host-temp:evidence/bug-linux-posix-path-classification-diagnosis.json"
    ]
  },
  "root_cause": {
    "status": "confirmed",
    "confidence": "high",
    "summary": "The POSIX stat result has no st_file_attributes member. _is_reparse_path catches that AttributeError together with operating-system errors and returns true, so normal paths are misclassified; treating the absent Windows-only member as zero restores both failed invariants without weakening actual symlink rejection.",
    "evidence_refs": [
      "host-temp:evidence/bug-linux-posix-path-classification-diagnosis.json"
    ]
  },
  "hypotheses": [],
  "active_hypothesis_id": null,
  "risk": {
    "security_privacy_or_data_risk": false,
    "redacted_summary": null,
    "secure_evidence_refs": [],
    "human_reviewer": null
  },
  "disposition": "current-run",
  "evidence_refs": [
    "host-temp:evidence/bug-linux-posix-path-classification-diagnosis.json",
    "host-temp:evidence/bug-linux-posix-path-classification-knowledge-context.json"
  ],
  "next_action": "Implementation executor transitions Verifying to Fixing, invalidates WP-003 and downstream WP-004, captures regression red, applies the one-cause POSIX classification fix, and reruns owner plus Windows/Linux full verification before fresh review.",
  "created_at": "2026-09-01T07:06:32.4094818Z"
}
