{
  "schema": "bug-assessment/v1",
  "bug_id": "bug-preliminary-review-ready-validation",
  "revision": 1,
  "markdown": {
    "path": "docs/bugs/bug-preliminary-review-ready-validation/assessment-1.md",
    "sha256": "9d255e9ae2548abfbd3ce8b105e3ed5bca878629cafa11b64e683ff679fcd07a"
  },
  "source": {
    "relation": "current-scope",
    "work_id": "work-20260831-project-knowledge-system-19202d78",
    "reported_by": "fresh preliminary product review round 1",
    "evidence_refs": [
      "host-temp:evidence/bug-preliminary-review-ready-validation-diagnosis.json",
      "host-temp:evidence/bug-preliminary-review-ready-validation-knowledge-context.json",
      "host-temp:reviews/preliminary-r1/report.json#PRELIM-R1-003"
    ]
  },
  "observed_behavior": "A preliminary report with missing Ready commands and source obligations has zero generic schema or semantic errors and is still accepted by persistence although Ready validation reports errors.",
  "expected_behavior": "Persistence, Outcome derivation and Delivery consumption load the same run-bound Ready handoff and require the owner Ready-review validator to return zero errors.",
  "impact": "Incomplete command and requirement coverage can be persisted and bound into an Outcome, weakening specification-to-review traceability.",
  "verdict": "confirmed",
  "severity": "high",
  "reproduction": {
    "status": "reproduced",
    "symptom_oracle": "Any Ready validation error causes all three preliminary-review consumer boundaries to fail closed.",
    "steps": [
      "Start from a schema-valid preliminary report.",
      "Remove Ready command outcomes and one source obligation while retaining generic validity.",
      "Compare Ready validator diagnostics with isolated persistence acceptance."
    ],
    "sample": "Generic schema and semantics returned zero errors, Ready validation returned two errors, and persistence accepted the report.",
    "command_refs": [
      "host-temp:commands/preliminary-r1/findings-red-probe.py"
    ],
    "evidence_refs": [
      "host-temp:commands/preliminary-r1/findings-red-probe.output.json",
      "host-temp:evidence/bug-preliminary-review-ready-validation-diagnosis.json"
    ]
  },
  "root_cause": {
    "status": "confirmed",
    "confidence": "high",
    "summary": "The persistence, Outcome and Delivery preliminary-review consumers invoke generic validation but omit the bound Ready handoff and validate_review_against_ready.",
    "evidence_refs": [
      "host-temp:evidence/bug-preliminary-review-ready-validation-diagnosis.json"
    ]
  },
  "hypotheses": [],
  "active_hypothesis_id": null,
  "risk": {
    "security_privacy_or_data_risk": false,
    "redacted_summary": null,
    "secure_evidence_refs": [],
    "human_reviewer": null
  },
  "disposition": "current-run",
  "evidence_refs": [
    "host-temp:commands/preliminary-r1/findings-red-probe.output.json",
    "host-temp:evidence/bug-preliminary-review-ready-validation-diagnosis.json",
    "host-temp:evidence/bug-preliminary-review-ready-validation-knowledge-context.json",
    "host-temp:reviews/preliminary-r1/report.json#PRELIM-R1-003"
  ],
  "next_action": "Implementation executor adds persistence, Outcome and Delivery Ready-validation reds, implements stable run-bound Ready loading, and reruns integration, full verification and fresh review.",
  "created_at": "2026-09-01T13:05:33.7715236Z"
}
