{
  "schema": "bug-assessment/v1",
  "bug_id": "bug-knowledge-promotion-registry-component-validation",
  "revision": 1,
  "markdown": {
    "path": "docs/bugs/bug-knowledge-promotion-registry-component-validation/assessment-1.md",
    "sha256": "bc315dc62762f2d4040dc4579af1ac68b7a1b0a499263249a85c1036b61a8868"
  },
  "source": {
    "relation": "current-scope",
    "work_id": "work-20260831-project-knowledge-system-19202d78",
    "reported_by": "fresh preliminary product review round 1",
    "evidence_refs": [
      "host-temp:evidence/bug-knowledge-promotion-registry-component-validation-diagnosis.json",
      "host-temp:evidence/bug-knowledge-promotion-registry-component-validation-knowledge-context.json",
      "host-temp:reviews/preliminary-r1/report.json#PRELIM-R1-002"
    ]
  },
  "observed_behavior": "Promotion Candidate loading accepts an ordinary leaf reached through a Windows junction ancestor that the shared component checker classifies as redirected.",
  "expected_behavior": "Sealing, loading and applying validate every existing component from the canonical registry root and use stable regular-file read or create boundaries.",
  "impact": "Promotion can accept or create Candidate bytes outside the canonical registry tree, breaking sealed identity and application integrity.",
  "verdict": "confirmed",
  "severity": "high",
  "reproduction": {
    "status": "reproduced",
    "symptom_oracle": "A junction ancestor is rejected before Candidate bytes are read while an ordinary registry path remains accepted.",
    "steps": [
      "Create an isolated Windows registry and an external Candidate tree.",
      "Make repos/<repo-id> a junction to that external tree while leaving candidate.json ordinary.",
      "Compare _candidate_path acceptance with the existing component-walk result."
    ],
    "sample": "The ancestor was a junction, the leaf was ordinary, the component checker returned true, and _candidate_path still accepted the Candidate path.",
    "command_refs": [
      "host-temp:commands/preliminary-r1/findings-red-probe.py"
    ],
    "evidence_refs": [
      "host-temp:commands/preliminary-r1/findings-red-probe.output.json",
      "host-temp:evidence/bug-knowledge-promotion-registry-component-validation-diagnosis.json"
    ]
  },
  "root_cause": {
    "status": "confirmed",
    "confidence": "high",
    "summary": "Promotion Candidate load and persistence resolve or inspect the leaf without a stable component walk from the canonical registry root across every existing ancestor.",
    "evidence_refs": [
      "host-temp:evidence/bug-knowledge-promotion-registry-component-validation-diagnosis.json"
    ]
  },
  "hypotheses": [],
  "active_hypothesis_id": null,
  "risk": {
    "security_privacy_or_data_risk": false,
    "redacted_summary": null,
    "secure_evidence_refs": [],
    "human_reviewer": null
  },
  "disposition": "current-run",
  "evidence_refs": [
    "host-temp:commands/preliminary-r1/findings-red-probe.output.json",
    "host-temp:evidence/bug-knowledge-promotion-registry-component-validation-diagnosis.json",
    "host-temp:evidence/bug-knowledge-promotion-registry-component-validation-knowledge-context.json",
    "host-temp:reviews/preliminary-r1/report.json#PRELIM-R1-002"
  ],
  "next_action": "Implementation executor adds Windows junction, ordinary-path and read or create drift reds, introduces shared component-safe registry primitives, and reruns Windows/Linux full verification.",
  "created_at": "2026-09-01T13:05:33.7715236Z"
}
