{
  "active_hypothesis_id": null,
  "bug_id": "bug-delivery-plan-revision-gap",
  "created_at": "2026-09-16T15:07:34Z",
  "disposition": "delivery",
  "evidence_refs": [
    "host-temp:bug-diagnosis/repos/c02a0b6fa293bdbf99be435da6898d63abd509d25d61bdc9b4409ea9b8210b99/works/work-20260916-natural-language-sdlc-v2/bug-delivery-plan-revision-gap/revision-1/knowledge-context.json",
    "host-temp:bug-diagnosis/repos/c02a0b6fa293bdbf99be435da6898d63abd509d25d61bdc9b4409ea9b8210b99/works/work-20260916-natural-language-sdlc-v2/bug-delivery-plan-revision-gap/revision-1/evidence/transition-failure.json",
    "host-temp:bug-diagnosis/repos/c02a0b6fa293bdbf99be435da6898d63abd509d25d61bdc9b4409ea9b8210b99/works/work-20260916-natural-language-sdlc-v2/bug-delivery-plan-revision-gap/revision-1/evidence/root-cause.json",
    "host-temp:delivery-orchestrator/repos/c02a0b6fa293bdbf99be435da6898d63abd509d25d61bdc9b4409ea9b8210b99/works/work-20260916-natural-language-sdlc-v2/run.json"
  ],
  "expected_behavior": "After a Ready plan revision 2, the next strictly increasing plan revision should be accepted even if the earlier superseded plan/ artifact was not materialized into the later generation.",
  "hypotheses": [],
  "impact": "The authorized feature is blocked before product code changes; no deployed product or user data is affected.",
  "markdown": {
    "path": "docs/bugs/bug-delivery-plan-revision-gap/assessment-2.md",
    "sha256": "bba69d63908f71a3b84e55dde5fe8116f95bf030afa0a71b5010c327cd8d9af7"
  },
  "next_action": "Plan and implement the bounded revision-allocation repair with local-only validation, then refresh and reapprove the affected feature plan.",
  "observed_behavior": "The approved Candidate-4 plan-3 transition fails with INVALID_REVISION and requests the absent plan/ path; the registry remains planning/active.",
  "reproduction": {
    "command_refs": [
      "host-temp:bug-diagnosis/repos/c02a0b6fa293bdbf99be435da6898d63abd509d25d61bdc9b4409ea9b8210b99/works/work-20260916-natural-language-sdlc-v2/bug-delivery-plan-revision-gap/revision-1/evidence/transition-failure.json"
    ],
    "evidence_refs": [
      "host-temp:bug-diagnosis/repos/c02a0b6fa293bdbf99be435da6898d63abd509d25d61bdc9b4409ea9b8210b99/works/work-20260916-natural-language-sdlc-v2/bug-delivery-plan-revision-gap/revision-1/evidence/transition-failure.json",
      "host-temp:delivery-orchestrator/repos/c02a0b6fa293bdbf99be435da6898d63abd509d25d61bdc9b4409ea9b8210b99/works/work-20260916-natural-language-sdlc-v2/run.json"
    ],
    "sample": "INVALID_REVISION: plan-3/handoff.json is not the smallest available revision; use plan/handoff.json.",
    "status": "reproduced",
    "steps": [
      "Run the Delivery transition for Candidate-4 plan-3 from the current generation-2 planning workspace."
    ],
    "symptom_oracle": "The approved Candidate-4 planning-to-implementation transition returns INVALID_REVISION and the Delivery event count stays at 9."
  },
  "revision": 2,
  "risk": {
    "human_reviewer": null,
    "redacted_summary": null,
    "secure_evidence_refs": [],
    "security_privacy_or_data_risk": false
  },
  "root_cause": {
    "confidence": "high",
    "evidence_refs": [
      "host-temp:bug-diagnosis/repos/c02a0b6fa293bdbf99be435da6898d63abd509d25d61bdc9b4409ea9b8210b99/works/work-20260916-natural-language-sdlc-v2/bug-delivery-plan-revision-gap/revision-1/evidence/root-cause.json",
      "host-temp:bug-diagnosis/repos/c02a0b6fa293bdbf99be435da6898d63abd509d25d61bdc9b4409ea9b8210b99/works/work-20260916-natural-language-sdlc-v2/bug-delivery-plan-revision-gap/revision-1/evidence/transition-failure.json"
    ],
    "status": "confirmed",
    "summary": "The allocator scans absent unrecorded revisions from 1, while the record validator requires new plan revisions to increase beyond recorded revision 2. Later-generation materialization omits the superseded plan/ directory, leaving no path that satisfies both rules."
  },
  "schema": "bug-assessment/v1",
  "severity": "medium",
  "source": {
    "evidence_refs": [
      "host-temp:bug-diagnosis/repos/c02a0b6fa293bdbf99be435da6898d63abd509d25d61bdc9b4409ea9b8210b99/works/work-20260916-natural-language-sdlc-v2/bug-delivery-plan-revision-gap/revision-1/evidence/transition-failure.json",
      "host-temp:delivery-orchestrator/repos/c02a0b6fa293bdbf99be435da6898d63abd509d25d61bdc9b4409ea9b8210b99/works/work-20260916-natural-language-sdlc-v2/run.json"
    ],
    "relation": "intake",
    "reported_by": "delivery-orchestrator",
    "work_id": null
  },
  "verdict": "confirmed"
}
