{
  "schema": "bug-assessment/v1",
  "bug_id": "bug-knowledge-page-closed-contract-lint",
  "revision": 1,
  "markdown": {
    "path": "docs/bugs/bug-knowledge-page-closed-contract-lint/assessment-1.md",
    "sha256": "7db526ec135ac56028769b65f75e6bbceef765b1fbe8df2f822fd0cf83b7fc8c"
  },
  "source": {
    "relation": "current-scope",
    "work_id": "work-20260831-project-knowledge-system-19202d78",
    "reported_by": "fresh preliminary product review round 1",
    "evidence_refs": [
      "host-temp:evidence/bug-knowledge-page-closed-contract-lint-diagnosis.json",
      "host-temp:evidence/bug-knowledge-page-closed-contract-lint-knowledge-context.json",
      "host-temp:reviews/preliminary-r1/report.json#PRELIM-R1-004"
    ]
  },
  "observed_behavior": "A knowledge page with a member forbidden by the closed page schema still produces a passed full lint result with zero diagnostics.",
  "expected_behavior": "Candidate sealing and full lint validate pages and nested members against the same closed knowledge-page/v1 definition and fail on every contract error.",
  "impact": "Non-contract knowledge state can become canonical and influence query, repair, Candidate and portability results with undefined field semantics.",
  "verdict": "confirmed",
  "severity": "high",
  "reproduction": {
    "status": "reproduced",
    "symptom_oracle": "Any unknown page, claim or source member causes sealing and lint to fail while an unchanged valid page remains lint-clean.",
    "steps": [
      "Build a lint-clean isolated knowledge repository.",
      "Add one unknown member to one valid page sidecar.",
      "Compare the closed schema result with full lint diagnostics."
    ],
    "sample": "Baseline lint passed with zero diagnostics; the closed schema returned one error after the mutation while full lint still passed with zero diagnostics.",
    "command_refs": [
      "host-temp:commands/preliminary-r1/findings-red-probe.py"
    ],
    "evidence_refs": [
      "host-temp:commands/preliminary-r1/findings-red-probe.output.json",
      "host-temp:evidence/bug-knowledge-page-closed-contract-lint-diagnosis.json"
    ]
  },
  "root_cause": {
    "status": "confirmed",
    "confidence": "high",
    "summary": "Runtime governance manually validates selected fields and never invokes the authoritative closed page definition during sealing or full lint.",
    "evidence_refs": [
      "host-temp:evidence/bug-knowledge-page-closed-contract-lint-diagnosis.json"
    ]
  },
  "hypotheses": [],
  "active_hypothesis_id": null,
  "risk": {
    "security_privacy_or_data_risk": false,
    "redacted_summary": null,
    "secure_evidence_refs": [],
    "human_reviewer": null
  },
  "disposition": "current-run",
  "evidence_refs": [
    "host-temp:commands/preliminary-r1/findings-red-probe.output.json",
    "host-temp:evidence/bug-knowledge-page-closed-contract-lint-diagnosis.json",
    "host-temp:evidence/bug-knowledge-page-closed-contract-lint-knowledge-context.json",
    "host-temp:reviews/preliminary-r1/report.json#PRELIM-R1-004"
  ],
  "next_action": "Implementation executor adds unknown-member reds for page, claim and source objects, centralizes runtime page schema validation, and reruns BDD-015 plus full suites.",
  "created_at": "2026-09-01T13:05:33.7715236Z"
}
