{
  "schema": "bug-assessment/v1",
  "bug_id": "bug-knowledge-candidate-ancestor-redirect",
  "revision": 1,
  "markdown": {
    "path": "docs/bugs/bug-knowledge-candidate-ancestor-redirect/assessment-1.md",
    "sha256": "9e53edb9529995413ba3eef4122ec5be770fba070334f3a0708a650dc0e8d357"
  },
  "source": {
    "relation": "current-scope",
    "work_id": "work-20260831-project-knowledge-system-19202d78",
    "reported_by": "fresh independent Delivery bundle review",
    "evidence_refs": [
      "host-temp:evidence/bug-knowledge-candidate-ancestor-redirect-diagnosis.json",
      "host-temp:evidence/bug-knowledge-candidate-ancestor-redirect-knowledge-context.json",
      "host-temp:reviews/delivery-bundle-fresh-review.json#DEL-FRESH-003"
    ]
  },
  "observed_behavior": "The sealed Candidate loader follows a Windows junction within the registry ancestor chain when the leaf candidate file itself is ordinary.",
  "expected_behavior": "Every path component from canonical registry root through the Candidate leaf rejects symlinks, junctions and reparse points and the leaf is read with stable no-follow semantics.",
  "impact": "Review and delivery snapshots can consume Candidate bytes outside the canonical registry, breaking sealed identity and promotion trust boundaries.",
  "verdict": "confirmed",
  "severity": "high",
  "reproduction": {
    "status": "reproduced",
    "symptom_oracle": "Ancestor and leaf redirects plus read-time swaps must return a stable Candidate error; an ordinary canonical registry path remains accepted.",
    "steps": [
      "Create an isolated Windows registry with repos/<repo_id> as a real junction to an external candidate tree.",
      "Keep the candidate.json leaf an ordinary file and call _candidate_path.",
      "Compare the accepted loader result with the shared component-walk _redirected result."
    ],
    "sample": "The independent Reviewer and main-agent probes each reproduced acceptance once; the shared redirect detector returned true for the same candidate path.",
    "command_refs": [
      "host-temp:commands/windows-candidate-junction-probe"
    ],
    "evidence_refs": [
      "host-temp:evidence/bug-knowledge-candidate-ancestor-redirect-diagnosis.json"
    ]
  },
  "root_cause": {
    "status": "confirmed",
    "confidence": "high",
    "summary": "default_registry_root checks only the registry root and _candidate_path checks only the leaf. No component-walk or stable no-follow read protects nested registry ancestors, so a repos/<repo_id> junction is transparently followed.",
    "evidence_refs": [
      "host-temp:evidence/bug-knowledge-candidate-ancestor-redirect-diagnosis.json"
    ]
  },
  "hypotheses": [],
  "active_hypothesis_id": null,
  "risk": {
    "security_privacy_or_data_risk": false,
    "redacted_summary": null,
    "secure_evidence_refs": [],
    "human_reviewer": null
  },
  "disposition": "current-run",
  "evidence_refs": [
    "host-temp:evidence/bug-knowledge-candidate-ancestor-redirect-diagnosis.json",
    "host-temp:evidence/bug-knowledge-candidate-ancestor-redirect-knowledge-context.json",
    "host-temp:reviews/delivery-bundle-fresh-review.json#DEL-FRESH-003"
  ],
  "next_action": "Implementation executor invalidates WP-002 and downstream WPs, adds real junction, leaf redirect and swap regression reds, then applies an equivalent component-safe stable Candidate read and reruns Windows, Linux and fresh review.",
  "created_at": "2026-09-01T08:39:17.2281502Z"
}

