{
  "schema": "bug-assessment/v1",
  "bug_id": "bug-knowledge-apply-commit-boundary-toctou",
  "revision": 1,
  "markdown": {
    "path": "docs/bugs/bug-knowledge-apply-commit-boundary-toctou/assessment-1.md",
    "sha256": "89b4e3171e846d065a06ce36d6831801adb38a715302bc5db2bf5ad216e9ea5d"
  },
  "source": {
    "relation": "current-scope",
    "work_id": "work-20260831-project-knowledge-system-19202d78",
    "reported_by": "fresh preliminary product review round 2",
    "evidence_refs": [
      "host-temp:evidence/bug-knowledge-apply-commit-boundary-toctou-diagnosis.json",
      "host-temp:commands/preliminary-r2-fresh-retry-fixing/windows-WP-002-red.txt",
      "host-temp:reviews/preliminary-r2-fresh-retry/report.json#FINDING-001"
    ]
  },
  "observed_behavior": "A create or update competitor introduced after the final preimage check is overwritten; apply reports success and writes a Ready receipt.",
  "expected_behavior": "Commit-boundary create-only or compare-and-swap semantics return PREIMAGE_DRIFT, preserve competitor bytes, and leave zero receipt and zero partial commit.",
  "impact": "Concurrent or external repository state can be lost, violating AC-013, BDD-013 and the retriable transaction guarantee.",
  "verdict": "confirmed",
  "severity": "critical",
  "reproduction": {
    "status": "reproduced",
    "symptom_oracle": "Competitor bytes injected after the final check remain byte-identical and no promotion receipt exists.",
    "steps": [
      "Seal one create Candidate and one update Candidate in isolated repositories.",
      "Inject competitor bytes immediately after _assert_operation_preimage_current returns.",
      "Continue apply and inspect the target, result, log and Ready receipt."
    ],
    "sample": "Before the fix, the two new tests were the only failures in the 16-test governance suite because KnowledgeError was not raised; reviewer probes on Windows and Linux also reported concurrent_bytes_preserved=false and receipt_count=1.",
    "command_refs": [
      "host-temp:commands/preliminary-r2-fresh-retry-fixing/windows-WP-002-red.txt"
    ],
    "evidence_refs": [
      "host-temp:evidence/bug-knowledge-apply-commit-boundary-toctou-diagnosis.json",
      "host-temp:reviews/preliminary-r2-fresh-retry/outputs/06-apply-commit-boundary-toctou-windows.json",
      "host-temp:reviews/preliminary-r2-fresh-retry/outputs/07-apply-commit-boundary-toctou-linux.json"
    ]
  },
  "root_cause": {
    "status": "confirmed",
    "confidence": "high",
    "summary": "apply_candidate separates its final preimage check from an overwriting os.replace call, leaving a check/use gap at the commit boundary.",
    "evidence_refs": [
      "host-temp:evidence/bug-knowledge-apply-commit-boundary-toctou-diagnosis.json"
    ]
  },
  "hypotheses": [],
  "active_hypothesis_id": null,
  "risk": {
    "security_privacy_or_data_risk": false,
    "redacted_summary": null,
    "secure_evidence_refs": [],
    "human_reviewer": null
  },
  "disposition": "current-run",
  "evidence_refs": [
    "host-temp:evidence/bug-knowledge-apply-commit-boundary-toctou-diagnosis.json",
    "host-temp:commands/preliminary-r2-fresh-retry-fixing/windows-WP-002-red.txt",
    "host-temp:reviews/preliminary-r2-fresh-retry/report.json#FINDING-001"
  ],
  "next_action": "Implementation executor uses atomic no-replace ownership transfer for create and update commit, makes rollback conditional on writer-owned bytes, then reruns Windows/Linux focused, full and fresh review.",
  "created_at": "2026-09-01T16:33:00Z"
}
