{
  "schema": "bug-assessment/v1",
  "bug_id": "bug-delivery-knowledge-formal-paths-bypass",
  "revision": 1,
  "markdown": {
    "path": "docs/bugs/bug-delivery-knowledge-formal-paths-bypass/assessment-1.md",
    "sha256": "766f38b9dcbca75f14da5c2366d64b8382664a3af774f9c26b530b6c686ad941"
  },
  "source": {
    "relation": "current-scope",
    "work_id": "work-20260831-project-knowledge-system-19202d78",
    "reported_by": "fresh independent Delivery bundle review",
    "evidence_refs": [
      "host-temp:evidence/bug-delivery-knowledge-formal-paths-bypass-diagnosis.json",
      "host-temp:evidence/bug-delivery-knowledge-formal-paths-bypass-knowledge-context.json",
      "host-temp:reviews/delivery-bundle-fresh-review.json#DEL-FRESH-001"
    ]
  },
  "observed_behavior": "Delivery required knowledge gates accept Requirements and Planning Ready receipts that omit formal_paths and persist bindings that also omit the manifest.",
  "expected_behavior": "Every Ready receipt binds canonical Git-eligible formal_paths; Requirements names exactly the current revision and Planning exactly matches the owner-validated complete Ready-plan bundle.",
  "impact": "An incomplete or incorrect formal artifact manifest can bypass the phase gate and allow implementation without a reproducible complete approved plan bundle.",
  "verdict": "confirmed",
  "severity": "high",
  "reproduction": {
    "status": "reproduced",
    "symptom_oracle": "A receipt without formal_paths must be rejected by Delivery with INVALID_KNOWLEDGE_PROMOTION while a complete owner-valid manifest remains accepted and is persisted exactly.",
    "steps": [
      "Run the existing required-stage-gates fixture while observing the receipt and returned promotion binding.",
      "Confirm both Requirements and Planning receipts lack formal_paths but are accepted.",
      "Pass the same receipts to project-knowledge validate_stage_promotion and observe MISSING_KNOWLEDGE_GATE."
    ],
    "sample": "One of one isolated Delivery fixture accepted two of two invalid receipts; the authoritative project-knowledge consumer rejected both.",
    "command_refs": [
      "host-temp:commands/delivery-formal-paths-acceptance-probe",
      "host-temp:commands/project-knowledge-formal-paths-comparison"
    ],
    "evidence_refs": [
      "host-temp:evidence/bug-delivery-knowledge-formal-paths-bypass-diagnosis.json"
    ]
  },
  "root_cause": {
    "status": "confirmed",
    "confidence": "high",
    "summary": "Delivery duplicates Ready receipt validation but omits formal_paths and does not call the authoritative project-knowledge stage validator; its positive fixture also omits the field, canonizing the bypass.",
    "evidence_refs": [
      "host-temp:evidence/bug-delivery-knowledge-formal-paths-bypass-diagnosis.json"
    ]
  },
  "hypotheses": [],
  "active_hypothesis_id": null,
  "risk": {
    "security_privacy_or_data_risk": false,
    "redacted_summary": null,
    "secure_evidence_refs": [],
    "human_reviewer": null
  },
  "disposition": "current-run",
  "evidence_refs": [
    "host-temp:evidence/bug-delivery-knowledge-formal-paths-bypass-diagnosis.json",
    "host-temp:evidence/bug-delivery-knowledge-formal-paths-bypass-knowledge-context.json",
    "host-temp:reviews/delivery-bundle-fresh-review.json#DEL-FRESH-001"
  ],
  "next_action": "Implementation executor stays in Fixing, adds missing, malformed and incomplete formal_paths regression reds, enforces owner-equivalent validation and persists exact formal_paths before rerunning producer, consumer, Delivery and fresh review.",
  "created_at": "2026-09-01T08:32:59.9407098Z"
}

