{
  "schema": "bug-assessment/v1",
  "bug_id": "bug-knowledge-apply-concurrent-state-loss",
  "revision": 1,
  "markdown": {
    "path": "docs/bugs/bug-knowledge-apply-concurrent-state-loss/assessment-1.md",
    "sha256": "7f2be2c218171e7600da69dd71b04dac597b0e853e8249e88c211fd3851c8146"
  },
  "source": {
    "relation": "current-scope",
    "work_id": "work-20260831-project-knowledge-system-19202d78",
    "reported_by": "fresh preliminary product review round 1",
    "evidence_refs": [
      "host-temp:evidence/bug-knowledge-apply-concurrent-state-loss-diagnosis.json",
      "host-temp:evidence/bug-knowledge-apply-concurrent-state-loss-knowledge-context.json",
      "host-temp:reviews/preliminary-r1/report.json#PRELIM-R1-001"
    ]
  },
  "observed_behavior": "A state written after Candidate preimage validation can be overwritten by commit and then deleted or replaced by failure rollback.",
  "expected_behavior": "Each commit and rollback action is conditional on exact validated or apply-owned bytes; a mismatch preserves the later state and yields zero committed paths.",
  "impact": "Concurrent or external repository state can be lost, violating the zero-commit and retriable guarantees of AC-013 and BDD-013.",
  "verdict": "confirmed",
  "severity": "high",
  "reproduction": {
    "status": "reproduced",
    "symptom_oracle": "The inserted later state remains byte-identical after the forced apply failure.",
    "steps": [
      "Seal one create Candidate in an isolated repository.",
      "Insert a different target state after preimage validation and before the first canonical replacement.",
      "Trigger the existing after-replace failure boundary and inspect the target after rollback."
    ],
    "sample": "The deterministic case injected one later state, returned PROMOTION_FAILED, and left the target absent instead of preserving those bytes.",
    "command_refs": [
      "host-temp:commands/preliminary-r1/findings-red-probe.py"
    ],
    "evidence_refs": [
      "host-temp:commands/preliminary-r1/findings-red-probe.output.json",
      "host-temp:evidence/bug-knowledge-apply-concurrent-state-loss-diagnosis.json"
    ]
  },
  "root_cause": {
    "status": "confirmed",
    "confidence": "high",
    "summary": "The apply loop has a precheck-to-replace gap and _rollback restores or removes targets without confirming that current bytes are still the apply-owned postimage.",
    "evidence_refs": [
      "host-temp:evidence/bug-knowledge-apply-concurrent-state-loss-diagnosis.json"
    ]
  },
  "hypotheses": [],
  "active_hypothesis_id": null,
  "risk": {
    "security_privacy_or_data_risk": false,
    "redacted_summary": null,
    "secure_evidence_refs": [],
    "human_reviewer": null
  },
  "disposition": "current-run",
  "evidence_refs": [
    "host-temp:commands/preliminary-r1/findings-red-probe.output.json",
    "host-temp:evidence/bug-knowledge-apply-concurrent-state-loss-diagnosis.json",
    "host-temp:evidence/bug-knowledge-apply-concurrent-state-loss-knowledge-context.json",
    "host-temp:reviews/preliminary-r1/report.json#PRELIM-R1-001"
  ],
  "next_action": "Implementation executor adds commit-mismatch and rollback-later-state regression reds, implements conditional commit and rollback, then reruns recovery, BDD-013, Windows/Linux full verification and fresh review.",
  "created_at": "2026-09-01T13:05:33.7715236Z"
}
