{
  "schema": "bug-assessment/v1",
  "bug_id": "bug-bdd020-review-query-tail",
  "revision": 1,
  "markdown": {
    "path": "docs/bugs/bug-bdd020-review-query-tail/assessment-1.md",
    "sha256": "15e7377a5253e6f709e9cde3141328ddf42753cf2f8c42097188fc7bc312a0b2"
  },
  "source": {
    "relation": "current-scope",
    "work_id": "work-20260902-skill-script-performance-0ae7b62a",
    "reported_by": "fresh-reviewer-preliminary-round-1-retry",
    "evidence_refs": [
      "reviews/preliminary-round-1/report.json",
      "reviews/preliminary-round-1/outputs/001-CMD-CI-001.txt",
      "diagnosis/bdd020-review-query-tail/profile.json",
      "diagnosis/bdd020-review-query-tail/causal-probe.json",
      "diagnosis/bdd020-review-query-tail/budget-probe.json"
    ]
  },
  "observed_behavior": "A fresh preliminary reviewer measured all five cold query samples and two of five warm query samples above the 2.0-second ceiling on the fixed 50,000-file workload; the other six full commands, functional parity, and fixture cleanup passed.",
  "expected_behavior": "Every one of five cold and five warm query samples must complete at or below 2.0 seconds with identical functional results and no fixture remaining.",
  "impact": "Normal Windows host-load variation causes the required portability CI to fail on unchanged product bytes, blocking the approved performance delivery without a correctness, cleanup, security, or privacy failure.",
  "verdict": "confirmed",
  "severity": "high",
  "reproduction": {
    "status": "reproduced",
    "symptom_oracle": "The symptom is present when any value in durations_seconds.cold_queries or durations_seconds.queries exceeds max_operation_seconds == 2.0.",
    "steps": [
      "Build the benchmark-defined repository containing exactly 50,000 tracked files.",
      "Run the fixed five-query fresh-process cold sequence and same-process warm sequence.",
      "Trace each query child process while keeping fixture, stage, query token, revision, and normalized result fixed."
    ],
    "sample": "Reviewer: five of five cold and two of five warm samples above 2.0 seconds. Controlled local baseline: one query at 1.97–2.05 seconds; split pre at 1.31 seconds, split post warm at 0.45 seconds, and fully split topology at 0.64–0.69 seconds.",
    "command_refs": [
      "CMD-CI-001"
    ],
    "evidence_refs": [
      "reviews/preliminary-round-1/outputs/001-CMD-CI-001.txt",
      "diagnosis/bdd020-review-query-tail/profile.json",
      "diagnosis/bdd020-review-query-tail/causal-probe.json",
      "diagnosis/bdd020-review-query-tail/budget-probe.json"
    ]
  },
  "root_cause": {
    "status": "confirmed",
    "confidence": "high",
    "summary": "The combined pre and post git ls-files dirty-inventory commands each trigger an expensive 50,000-path working-tree scan, consuming about 1.6 seconds of a roughly 2.0-second query. Controlled substitution of staged inventory, git diff-files, and untracked discovery removes the tail while preserving normalized results; direct index-path resolution and staged attribute-path reuse keep the complete query at nine child processes.",
    "evidence_refs": [
      "diagnosis/bdd020-review-query-tail/profile.json",
      "diagnosis/bdd020-review-query-tail/causal-probe.json",
      "diagnosis/bdd020-review-query-tail/budget-probe.json"
    ]
  },
  "hypotheses": [
    {
      "hypothesis_id": "H-001",
      "rank": 1,
      "statement": "The working-tree scans forced by combined git ls-files fingerprint commands cause the two-second query tail.",
      "variable": "Dirty-inventory Git command topology only.",
      "prediction": "Replacing only the pre or post topology lowers its corresponding cold or warm latency, and replacing both keeps results equal below two seconds.",
      "falsifier": "Latency does not fall, normalized results change, or search remains the dominant child cost.",
      "outcome": "supported",
      "evidence_refs": [
        "diagnosis/bdd020-review-query-tail/causal-probe.json"
      ]
    },
    {
      "hypothesis_id": "H-002",
      "rank": 2,
      "statement": "git grep --cached is the dominant query bottleneck.",
      "variable": "Observed git grep child wall time with fingerprint behavior fixed.",
      "prediction": "git grep consumes most of the query and fingerprint substitution has little effect.",
      "falsifier": "git grep remains near 0.16 seconds while fingerprint substitution reduces the whole query below one second.",
      "outcome": "falsified",
      "evidence_refs": [
        "diagnosis/bdd020-review-query-tail/profile.json",
        "diagnosis/bdd020-review-query-tail/causal-probe.json"
      ]
    },
    {
      "hypothesis_id": "H-003",
      "rank": 3,
      "statement": "Fixture construction or readiness warm-up is included in each timed query.",
      "variable": "Query-internal child calls only.",
      "prediction": "No pair of large fingerprint tails appears inside a query, or removing them leaves the query above two seconds.",
      "falsifier": "Two approximately 0.8-second fingerprint calls appear inside the query and the controlled candidate completes in 0.64 seconds.",
      "outcome": "falsified",
      "evidence_refs": [
        "diagnosis/bdd020-review-query-tail/profile.json",
        "diagnosis/bdd020-review-query-tail/budget-probe.json"
      ]
    }
  ],
  "active_hypothesis_id": null,
  "risk": {
    "security_privacy_or_data_risk": false,
    "redacted_summary": null,
    "secure_evidence_refs": [],
    "human_reviewer": null
  },
  "disposition": "current-run",
  "evidence_refs": [
    "diagnosis/bdd020-review-query-tail/knowledge-context.json",
    "reviews/preliminary-round-1/report.json",
    "reviews/preliminary-round-1/outputs/001-CMD-CI-001.txt",
    "diagnosis/bdd020-review-query-tail/profile.json",
    "diagnosis/bdd020-review-query-tail/causal-probe.json",
    "diagnosis/bdd020-review-query-tail/budget-probe.json"
  ],
  "next_action": "The implementation writer must first add regression red coverage for split inventory parity, drift detection, captured attribute-path reuse, and the ten-process ceiling, then apply the single fingerprint-topology change and rerun five cold, five warm, and all required full commands.",
  "created_at": "2026-09-03T03:04:21.1934374Z"
}
