{
  "schema": "bug-assessment/v1",
  "bug_id": "bug-linux-delivery-posix-path-classification",
  "revision": 1,
  "markdown": {
    "path": "docs/bugs/bug-linux-delivery-posix-path-classification/assessment-1.md",
    "sha256": "f703b6082a8aa76bbbef31e22b560615c8c69d0262a5943949c7fda0bda3fa61"
  },
  "source": {
    "relation": "current-scope",
    "work_id": "work-20260831-project-knowledge-system-19202d78",
    "reported_by": "implementation-execution native Linux full verification",
    "evidence_refs": [
      "host-temp:evidence/bug-linux-delivery-posix-path-classification-diagnosis.json",
      "host-temp:evidence/bug-linux-delivery-posix-path-classification-knowledge-context.json"
    ]
  },
  "observed_behavior": "The native Linux full suite reaches its final Delivery workspace subcommand and then reports 5 failures and 20 errors because ordinary artifact paths are classified as symlink or reparse redirects.",
  "expected_behavior": "Ordinary POSIX artifact paths pass stable no-follow validation, genuine symlinks remain fail closed, and all Delivery workspace transition oracles execute.",
  "impact": "The defect blocks the approved Linux full-suite and release gates while the same 17-command suite passes on Windows.",
  "verdict": "confirmed",
  "severity": "medium",
  "reproduction": {
    "status": "reproduced",
    "symptom_oracle": "The Linux full suite has exactly one failing subcommand before correction; ordinary directories classify false, genuine symlinks true, and Delivery workspace tests pass after the single-variable correction.",
    "steps": [
      "Run the full project-knowledge suite in the native Linux validation copy.",
      "Probe Delivery _is_reparse_path on an ordinary temporary directory.",
      "Replace only missing POSIX st_file_attributes handling at runtime and rerun discoverable Delivery tests."
    ],
    "sample": "Full suite reproduced in one of one attempts; 100 discoverable Delivery tests passed in one of one controlled pre/post attempt.",
    "command_refs": [
      "host-temp:commands/linux-full-suite-fixing-1",
      "host-temp:commands/linux-delivery-posix-single-variable-probe"
    ],
    "evidence_refs": [
      "host-temp:evidence/bug-linux-delivery-posix-path-classification-diagnosis.json"
    ]
  },
  "root_cause": {
    "status": "confirmed",
    "confidence": "high",
    "summary": "The POSIX stat result lacks st_file_attributes. Delivery _is_reparse_path catches that AttributeError together with operating-system inspection errors and returns true, so normal paths fail before transition validation; treating only the absent Windows-specific member as zero restores the suite while retaining actual error and symlink rejection.",
    "evidence_refs": [
      "host-temp:evidence/bug-linux-delivery-posix-path-classification-diagnosis.json"
    ]
  },
  "hypotheses": [],
  "active_hypothesis_id": null,
  "risk": {
    "security_privacy_or_data_risk": false,
    "redacted_summary": null,
    "secure_evidence_refs": [],
    "human_reviewer": null
  },
  "disposition": "current-run",
  "evidence_refs": [
    "host-temp:evidence/bug-linux-delivery-posix-path-classification-diagnosis.json",
    "host-temp:evidence/bug-linux-delivery-posix-path-classification-knowledge-context.json"
  ],
  "next_action": "Implementation executor invalidates and re-executes WP-003, applies the single confirmed-cause Delivery POSIX classification fix, then resumes WP-004 Linux full verification and fresh review.",
  "created_at": "2026-09-01T07:58:37.7112375Z"
}

