{
  "schema": "bug-assessment/v1",
  "bug_id": "bug-knowledge-candidate-publish-overwrite",
  "revision": 1,
  "markdown": {
    "path": "docs/bugs/bug-knowledge-candidate-publish-overwrite/assessment-1.md",
    "sha256": "105bfee0e5ff4d00e46d5c59b55b031755894c594c8992e9ef3bf2d8105a1531"
  },
  "source": {
    "relation": "current-scope",
    "work_id": "work-20260831-project-knowledge-system-19202d78",
    "reported_by": "fresh preliminary round 2 invalid-snapshot review",
    "evidence_refs": [
      "host-temp:evidence/bug-knowledge-candidate-publish-overwrite-diagnosis.json",
      "host-temp:evidence/bug-knowledge-candidate-publish-overwrite-red.json",
      "host-temp:reviews/preliminary-r2-invalid-snapshot/reviewer-response.txt"
    ]
  },
  "observed_behavior": "Linux Candidate publication replaces a competing empty final registry directory created at the commit boundary and returns success, while Windows rejects the same destination.",
  "expected_behavior": "Windows and Linux publish sealed Candidate directories with an atomic create-only primitive; an occupied final name yields CANDIDATE_EXISTS and preserves the existing entry.",
  "impact": "Independent concurrent registry state can be lost, invalidating immutable Candidate identity and cross-platform delivery evidence.",
  "verdict": "confirmed",
  "severity": "high",
  "reproduction": {
    "status": "reproduced",
    "symptom_oracle": "A final Candidate directory created after the last safety check remains the same inode and sealing fails with CANDIDATE_EXISTS.",
    "steps": [
      "Prepare a valid staged Candidate in an isolated host-temp registry.",
      "Create the same final Candidate directory immediately before the directory publish call.",
      "Run the Windows POSIX-semantics regression and the same governance test on native Linux under WSL."
    ],
    "sample": "Before the fix, both 15-test runs had exactly one failure: KnowledgeError was not raised; the reviewer Linux probe reported competitor_preserved=false and result=returned.",
    "command_refs": [
      "host-temp:commands/preliminary-r2/candidate-publish-windows-red.txt",
      "host-temp:commands/preliminary-r2/candidate-publish-linux-red.txt"
    ],
    "evidence_refs": [
      "host-temp:evidence/bug-knowledge-candidate-publish-overwrite-diagnosis.json",
      "host-temp:evidence/bug-knowledge-candidate-publish-overwrite-red.json"
    ]
  },
  "root_cause": {
    "status": "confirmed",
    "confidence": "high",
    "summary": "The final staged Candidate directory is published with os.replace, whose POSIX semantics permit replacing an existing empty directory instead of enforcing create-only identity.",
    "evidence_refs": [
      "host-temp:evidence/bug-knowledge-candidate-publish-overwrite-diagnosis.json"
    ]
  },
  "hypotheses": [],
  "active_hypothesis_id": null,
  "risk": {
    "security_privacy_or_data_risk": false,
    "redacted_summary": null,
    "secure_evidence_refs": [],
    "human_reviewer": null
  },
  "disposition": "current-run",
  "evidence_refs": [
    "host-temp:evidence/bug-knowledge-candidate-publish-overwrite-diagnosis.json",
    "host-temp:evidence/bug-knowledge-candidate-publish-overwrite-red.json",
    "host-temp:reviews/preliminary-r2-invalid-snapshot/reviewer-response.txt"
  ],
  "next_action": "Implementation executor uses Windows no-replace rename and Linux renameat2(RENAME_NOREPLACE), fails closed when unavailable, then reruns Windows/Linux governance and full verification before a new fresh preliminary review.",
  "created_at": "2026-09-01T14:49:43.1938288Z"
}
